{
  "schema_version": 1,
  "request_id": "01JBFB0REQVEST100000000000",
  "method": "mcp.get_context",
  "direction": "request",
  "payload": {
    "agent_request": {
      "request": {
        "schema_version": 1,
        "run_execution_id": "01JBFB0EXECXXXX00000000000",
        "assignment_generation": 7,
        "request_id": "agent-read-001"
      },
      "correlation": "synthetic-agent-correlation-001"
    }
  }
}
